[
  {
    "template_id": "q_5c1e09ab",
    "sql": "SELECT SUM(c_4d2e6b10) FROM t_7a3f91c2 WHERE c_19c2d04e = ? AND c_88b1a7f3 >= ?",
    "calls": 120,
    "mean_ms": 410.0,
    "total_ms": 49200.0,
    "columns": [
      {
        "table": "t_7a3f91c2",
        "col": "c_4d2e6b10",
        "role": "SELECT"
      },
      {
        "table": "t_7a3f91c2",
        "col": "c_19c2d04e",
        "role": "EQ"
      },
      {
        "table": "t_7a3f91c2",
        "col": "c_88b1a7f3",
        "role": "RANGE"
      }
    ]
  }
]
